Investor name,Website,Global HQ,Countries of investment,Stage of investment,Investment thesis,Investor type,First cheque minimum,First cheque maximum
Inference Partners,https://www.inferencepartners.com,"London, United Kingdom","austria,belgium,bulgaria,croatia,cyprus,czech republic,denmark,estonia,finland,france,germany,greece,hungary,ireland,italy,latvia,lithuania,luxembourg,malta,netherlands,poland,portugal,romania,slovenia,slovakia,spain,sweden,iceland,norway,switzerland,israel,usa,canada,australia,hong kong,singapore","2. Prototype,3. Early Revenue,4. Scaling,5. Growth","We invest in early stage infrastructure software (data and cloud infrastructure, machine learning & data science, developer tools, cybersecurity, blockchain infrastructure, payment infrastructure) startups.",VC,$100000,$10000000
The Net Street Capital,https://thenetstreet.com/,"London, UK","france,spain,germany,italy,uk,israel,china,mexico,brazil,chile,ecuador,netherlands","5. Growth,4. Scaling,3. Early Revenue",We invest in SAAS B2B insurtech and fintech founders,VC,$2000000,$10000000
Uno Ventures,https://angel.co/uno-ventures/syndicate,"Mexico City, Mexico","mexico,chile,brazil,argentina,colombia,peru,uruguay","1. Idea or Patent,2. Prototype,3. Early Revenue,4. Scaling","We invest in early-stage startups and founders based in Latin America. Due to the breadth of opportunities in the region, we take a “sector agnostic” approach when reviewing deals, but we are actively looking out for ventures in B2B Software, Consumer Software, Education, Fintech, and Healthcare spaces.",Angel network,$100000,$250000
Raison Asset Management,https://raison.am/en/investments/strategies/hidden-leaders-pre-ipo-shares/,"Roosikrantsi 11, Tallinn, 10119, Estonia","usa,germany,israel,portugal,estonia,canada,france,russia","3. Early Revenue,4. Scaling,5. Growth,6. Pre-IPO","We invest in technological startups starting from revenue generating stage, in fintech, cybersecurity, artificial intelligence, foodtech, new materials, e-commerce.",PE fund,$100000,$5000000
Impression Ventures,https://impression.ventures/,"Toronto, Ontario, Canada","canada,usa","2. Prototype,3. Early Revenue","We invest in seed stage FinTech companies across North America, and have been doing so since 2013. We focus on founders who are driven on changing how financial services are provided to a large market.",VC,$1000000,$3000000
Next47,https://next47.com/,"537 Hamilton Ave, Palo Alto CA 94103, United States ","usa,germany,uk,france,israel,canada","3. Early Revenue,4. Scaling,5. Growth","We invest in B2B startups in North America, Europe, and Israel focused on enterprise tech (SaaS, IT & infra) as well as industrial tech (manufacturing, construction, proptech, energy, transportation, logistics and supply chain). ",VC,$2000000,$40000000
Folklore Ventures,https://www.folklore.vc/,"4 / L1 16 Eveleigh St, Redfern, NSW Australia 2016","australia,new zealand","1. Idea or Patent,2. Prototype,3. Early Revenue,4. Scaling","We invest in Australian and NZ founders building software, advanced tech and Web3 companies anywhere in the world",VC,$250000,$5000000
Best Nights VC,https://bestnights.vc/,"M-Venture GmbH, Jägermeisterstr. 7-15, 38296 Wolfenbüttel","germany,france,uk,italy,netherlands,belgium,spain,portugal,poland,czech republic,croatia,ukraine,denmark,sweden,norway,usa,china,india,south africa,japan,mexico","3. Early Revenue,2. Prototype,4. Scaling","We invest in the most ambitious entrepreneurs with the mission to shape the nightlife of the future. With our Investments we empower people to have THE BEST NIGHTS OF THEIR LIFE and are re-defining the cultural lives of our young urban target group

We invest INTERNATIONAL from SEED TO SERIES A with a TICKET SIZE of EUR 250K – 1.5M. We invest in Consumer-Tech and focus on Digital Interactive Experiences, GenZ driven Consumer Brands, Social Gaming, Social + Communities, Revival of Offline Experiences and Mindful Celebrations. ",Corporate VC,$100000,$1500000
Sheesha Finance,https://www.sheeshafinance.io/,"ALMAS-48-CV34 ALMAS Tower Plot, JLT-PH1-A0 Jumeirah Lakes Towers, Dubai, United Arab Emirates","afghanistan,albania,algeria,andorra,angola,antigua and barbuda,argentina,armenia,australia,austria,azerbaijan,bahamas,bahrain,bangladesh,barbados,belarus,belgium,belize,benin,bhutan,bolivia,bosnia-h,botswana,brazil,brunei,bulgaria,burkina faso,burundi,cabo verde,cambodia,cameroon,canada,central african republic,chad,chile,china,colombia,comoros,congo (congo-brazzaville),costa rica,côte d'ivoire,croatia,cuba,cyprus,czech republic,drc congo,denmark,djibouti,dominica,dominican republic,ecuador,egypt,el salvador,equatorial guinea,eritrea,estonia,""eswatini (fmr. """"swaziland"""")"",ethiopia,fiji,finland,france,gabon,gambia,georgia,germany,ghana,greece,grenada,guatemala,guinea,guinea-bissau,guyana,haiti,holy see,honduras,hong kong,hungary,iceland,india,indonesia,iran,iraq,ireland,israel,italy,jamaica,japan,jordan,kazakhstan,kenya,kiribati,kuwait,kyrgyzstan,laos,latvia,lebanon,lesotho,liberia,liechtenstein,lithuania,luxembourg,lybia,madagascar,malawi,malaysia,maldives,mali,malta,marshall islands,mauritania,mauritius,mexico,micronesia,moldova,monaco,mongolia,montenegro,morocco,mozambique,myanmar,namibia,nauru,nepal,netherlands,new zealand,nicaragua,niger,nigeria,north macedonia,norway,oman,pakistan,palau,palestine,panama,papua new guinea,paraguay,peru,philippines,poland,portugal,qatar,romania,russia,rwanda,saint vincent and the grenadines,samoa,san marino,sant kitts and nevis,sant lucia,sao tome and principe,saudi arabia,senegal,serbia,seychelles,sierra leone,singapore,slovakia,slovenia,solomon islands,somalia,south africa,south korea,south sudan,spain,sri lanka,sudan,suriname,sweden,switzerland,syria,taiwan,tajikistan,tanzania,thailand,timor-leste,togo,tonga,trinidad and tobago,tunisia,turkey,turkmenistan,tuvalu,uae,uganda,uk,ukraine,uruguay,usa,uzbekistan,vanuatu,venezuela,vietnam,zambia,zimbabwe","1. Idea or Patent,2. Prototype,3. Early Revenue,4. Scaling,5. Growth","We invest in long-term projects at the earliest stage that pave the way for mass blockchain adoption across different border, barriers and ecosystems. As a decentralized VC investing, we aim to diversify our portfolio, investing in DeFi, Gaming, NFT, Real World application and encourage ESG narratives.",VC,$100000,$1000000
Rebel One,https://rbl1.com/,"Chicago, IL",usa,"2. Prototype,3. Early Revenue,4. Scaling,5. Growth",We invest in pre-seed and seed stage startups based out of the U.S. that are focused on accelerating founders building a better world.,Angel network,$50000,$750000
SaaSholic,https://www.saasholic.com/,"Professor Atilio Innocenti, 165 - Vila Nova Conceição, Sao Paulo - SP, 04538-000, Brazil","brazil,colombia,mexico,paraguay,uruguay,argentina,chile,venezuela,usa,peru,panama","1. Idea or Patent,2. Prototype,3. Early Revenue,4. Scaling","We invest in the best early-stage Latam SaaS companies.

We are looking for companies that have their MVP/product live and are already generating some revenue from unaffiliated customers.
These startups are typically raising their first investment checks and aim to validate their product-market fit before entering a scale-up phase.

SaaSholic is managed by SaaS operators, not analysts from the financial market or wealthy but inexperienced individual angels. We’ve been there and we know what it takes for a SaaS business to be successful.

We typically help our portfolio startups with go-to-market, marketing strategy, creating and scaling their salesforce, choosing the right tech infrastructure, company culture, leadership principles, and Delaware/Cayman incorporation.

(We’re not referring to the Silicon Valley cliché tips everyone reads in books and articles. We’re talking about real-life things that we’ve been through or have seen working in the LatAm market peculiarities.)

Partners:

Diego Gomes is also a co-founder @Rock Content. In his spare time, he coauthors the SaaSWorld Research and is always looking to support/invest in promising SaaS early-stage startups. Diego is also the creator of Dealbook.co, a platform to track angels and VC deals in LatAm. He is also an Endeavor entrepreneur and mentor.

Gustavo Souza is a Managing Partner at SaaSholic, an early stage micro-VC focused on LATAM SaaS. Experienced in sales and managing enterprise-focused SaaS products. Gustavo is a lawyer by formation but has found in sales+marketing his areas of true interest and excellence.

William Cordeiro is a Venture Capitalist based in Brazil. Over the last 5 years, he built GVAngels, one of the most active angel networks in the country where he lead close to 50 deals and have had deployed over U$15M. He's currently a managing partner at SaaSholic, a leading Micro VC focused on SaaS companies in LatAm.",VC,$100000,$500000
Roble Ventures,https://robleventures.com/,"466 Raquel Ln, Los Altos, California 94022, US","argentina,brazil,chile,colombia,mexico,peru,usa","3. Early Revenue,4. Scaling","We invest in companies who meet the following criteria:
1. You are interested in raising a seed or post-seed round from a firm like ours within the next year or so. Our typical initial investment is $200k-$2M.
2. Your startup fits within our Human Enablement thematic approach. More info is available on our website.",VC,$200000,$2000000
Angel Club,https://angelclub.com,"53 Summit Rd, San Anselmo, CA 94960","usa,uk,canada,mexico,argentina,brazil,colombia",3. Early Revenue,We invest in consumer technology at seed-stage with a special focus on female and diverse founders. We also invest in talented teams and start-ups where we believe we can be strategic and helpful beyond capital. ,Angel network,$10000,$150000
Quansight Initiate,https://qi.ventures,"8656 W Hwy 71, Bldg F200, Austin, TX 78735",usa,"1. Idea or Patent,2. Prototype,3. Early Revenue",We invest in early-stage companies that heavily use or develop open-source libraries and are eager to connect with and support the open-source communities they depend on.,VC,$25000,$450000
MAIF Impact,https://entreprise.maif.fr/engagements/economie-responsable/maif-impact,"156 rue de l'université, Paris",france,"2. Prototype,3. Early Revenue,4. Scaling,5. Growth","We invest in impact start-ups, mostly in Seed or Series A. We are sector agnostic, but impact must be a core composant of the business model. ",Corporate VC,$300000,$2000000
Atomico,https://www.atomico.com/,"29 Rathbone Street, London, England W1T 1NJ, GB","albania,austria,belarus,belgium,bulgaria,croatia,czech republic,denmark,estonia,finland,france,germany,greece,hungary,iceland,ireland,italy,latvia,lithuania,netherlands,norway,poland,portugal,spain,sweden,switzerland,uk","3. Early Revenue,4. Scaling,5. Growth","We invest in ambitious tech founders at Series A and beyond with a particular focus on Europe, leveraging deep operational experience to supercharge their growth.",VC,$5000000,$20000000
Pario Ventures,https://www.parioventures.com/,"35 Berkeley Square  Mayfair   London, W1J 5BF. UK","uk,usa","3. Early Revenue,4. Scaling,5. Growth","We invest in Automotive, Mobility, Fintech, Oil and Gas, Blockchain startups with $500k ARR. 
We also finance older companies looking to exit.
We invest in UK companies wanting to expand to the USA",VC,$150000,$10000000
Stacks Accelerator,https://stacks.ac/,New York,usa,"2. Prototype,3. Early Revenue,4. Scaling",We invest in outstanding startups building decentralized apps on Bitcoin with the Stacks blockchain.,"Incubator, Accelerator",$50000,$100000
Blueberry Muffin,https://www.bbm.ventures/,"Bucharest, Romania",romania,"1. Idea or Patent,2. Prototype,3. Early Revenue,4. Scaling",We invest in digitally enabled businesses ,VC,$200000,$1000000
Fintech Start,http://fintech-start.ru/en,"6 Shvernika St, Moscow, CA 117292, Russian Federation","russia,ukraine,kazakhstan,belarus,latvia,lithuania,uzbekistan,tajikistan,moldova","2. Prototype,3. Early Revenue",We invest in in fintech projects at the MVP stage and above.,Public fund,$50000,$100000
Investible,https://investible.com,"7/45 Clarence Street, Sydney, Australia","australia,israel,singapore,indonesia,philippines,malaysia,new zealand,poland,canada,usa,vietnam,uk,germany,netherlands,france,thailand,denmark,belgium,sweden,norway,finland,iceland,spain,italy","2. Prototype,3. Early Revenue,1. Idea or Patent,4. Scaling",We invest in early-stage technology startups—primarily in Australia and Southeast Asia—through our sector-agnostic and Climate Tech fund(s). More at https://investible.com/get-investment/,VC,$175000,$2000000
TwinklHive,https://www.twinkl.co.uk/hive,"Sheffield, UK ","uk,usa",3. Early Revenue,We invest in EdTech and Tech for Good startups MVP ready and beyond,"Incubator, Accelerator",$100000,$1000000
Act Venture Partners,https://act-vc.com/,"Amsterdam, Netherlands","denmark,finland,germany,ireland,netherlands,spain,sweden,uk,turkey","3. Early Revenue,4. Scaling",We invest in European tech entrepreneurs at an early stage. ,VC,$100000,$1000000
Quidnet Ventures,https://www.quidnetventures.com,"7 Azalea Drive, Mill Valley, CA 94941",new zealand,"1. Idea or Patent,2. Prototype,3. Early Revenue",We invest in New Zealand deep tech startups that have global ambition.,VC,$50000,$500000
Starburst Ventures,https://starburst.aero/,"840 Apollo Street, El Segundo, CA90245","canada,usa,france,germany,uk,australia","1. Idea or Patent,2. Prototype,3. Early Revenue","We invest in the fearless, building our future Aeropsace & Defense. We invest in the aviation, space, and defense sectors as well as enabling Sciences & Technology (artificial intelligence, cybersecurity, new materials, energy, robotics, computing, etc). We look for companies with significantly differentiated IP in massive markets.",VC,$200000,$1000000
Newzone Ventures,https://newzone.vc/,"London, United Kingdom","austria,uk,switzerland,sweden,slovenia,spain,romania,portugal,slovakia,poland,norway,monaco,luxembourg,lithuania,latvia,italy,ireland,iceland,greece,germany,finland,bulgaria,belgium,estonia,cyprus,czech republic,denmark,france,hungary","4. Scaling,5. Growth","We invest in tech-enabled disruptive businesses with the aim to be a supportive and hands-on partner. 
Our focus is on companies with the following criteria: 
- Pan-European and Israel
- Tech-enabled / highly scalable operating models 
- Team with ability to execute (not pure focus on pedigree) and ability to adjust to changes quickly  
- B2B / B2B2C / Marketplaces ",VC,$500000,$10000000
Callais Capital,https://callaiscapital.com/,"401 Focus Street, Thibodaux, LA 70301 United States",usa,"3. Early Revenue,4. Scaling","We invest in regional startups benefiting from long-term inevitable trends, in big markets, with diverse, equitable and inclusive teams. ",VC,$500000,$3000000
Supply Change Capital,https://www.supplychangecapital.fund/,"Los Angeles, CA",usa,"1. Idea or Patent,2. Prototype,3. Early Revenue","We invest at the intersection of food, tech and culture - specific verticals include food and ag tech, ingredient tech, and CPG. ",VC,$500000,$1000000
Prithvi Ventures,https://www.prithvivc.com/,New York,"usa,singapore,uk,australia,south africa,canada","2. Prototype,3. Early Revenue,4. Scaling,5. Growth,6. Pre-IPO",We invest in climate-focused startups,VC,$100000,$9500000
USC Marshall Greif Incubator,https://www.marshall.usc.edu/departments/lloyd-greif-center-entrepreneurial-studies/programs/usc-marshall-greif-incubator,"3670 Trousdale Pkwy, Los Angeles, CA 90089",usa,"2. Prototype,3. Early Revenue",We incubate startups with founders affiliated with USC.,"Incubator, Accelerator",$1000,$10000
SCOR Ventures,https://www.scor.com/en/scor-pc-ventures,"5, avenue Kléber, 75 795 Paris Cedex 16, Paris","uk,france,germany,spain,portugal,poland,austria,denmark,sweden,finland,norway,italy,latvia,estonia,ireland,greece,usa,canada,brazil,mexico,singapore,indonesia,australia,india,pakistan","3. Early Revenue,4. Scaling","We invest in: (1) the ‘Insurers of the Future’: tech-driven underwriting companies (MGAs, carriers) that offer multiple points of digital and business model differentiation. (2) any type of software solution connected to risk, from trade finance to predictive maintenance. (3) any solution helping people live healthier lives.",Corporate VC,$1000000,$10000000
Vertex Ventures (Southeast Asia and India),https://www.vertexventures.sg/,"250 North Bridge Road, #11-01. Raffles City Tower, Singapore 179101","singapore,malaysia,thailand,cambodia,laos,myanmar,vietnam,brunei,indonesia,philippines,india","3. Early Revenue,4. Scaling,5. Growth","We invest in high-growth startups seeking their first round of institutional venture capital funding globally (pre-series A, Series A and beyond).

We are not your typical VC firm. We are known to be “Co-founders” to the startups we invest in. We support our portfolio companies in terms of:

- Talent Acquisition
- Expert Domain Knowledge
- Business Development & Strategic Partnerships
- Next Round of Funding",VC,$1000000,$10000000
Halogen Ventures,https://halogenvc.com/,"Los Angeles, CA 90094, US",usa,"2. Prototype,3. Early Revenue","We invest in pre-seed, seed and series A companies creating groundbreaking technologies and products in the consumer space. We are hands on and support our founders through their full lifecycle. We help them build their networks, get brand exposure, hire great talent, raise follow-on rounds and find their path to acquisition or IPO.",VC,$100000,$3000000
Allied Venture Partners,https://www.allied.vc,"315 3rd Street SE, Calgary, AB Canada","canada,usa","2. Prototype,3. Early Revenue,4. Scaling","We invest in post-product/revenue, Seed and Series A software and technology companies across Canada and the USA. We are industry agnostic, however, do not invest in Medtech, Biotech, Healthcare or Cannabis. 

For our complete investment thesis, please visit www.allied.vc/thesis",Angel network,$100000,$300000
Plymouth Growth,https://plymouthgp.com/,"555 Briarwood Circle #210, Ann Arbor, MI, United States","canada,usa","3. Early Revenue,4. Scaling,5. Growth","We invest in mid-continent B2B software and technology companies – with $3MM to $10MM in revenue, proven business models, and strong teams – that are ready to scale. The Plymouth team brings decades of experience as operators, advisors, and investors, and understands that while metrics matter, it’s people that are critical to growth. ",VC,$4000000,$12000000
Dynamk Capital,https://www.dynamk.vc/,"30 Wall Street, New York, NY 10005, United States",usa,"2. Prototype,3. Early Revenue,4. Scaling","We invest in life science industrials - the tools, technologies, and services enabling discovery, development, and manufacturing of the life science industry",VC,$500000,$7000000
TecPier,https://tecpier.com,"Ludwig-Erhard-Str. 22, 20459 Hamburg, Germany","usa,germany,uk,singapore,denmark,norway,sweden,finland,greece,canada,netherlands,belgium,australia,poland,switzerland,portugal,spain,italy,france,luxembourg","1. Idea or Patent,2. Prototype,3. Early Revenue","We invest in maritime, logistics and supply chain startups at pre-seed/seed stage in Europe, US and Asia.",VC,$100000,$500000
Bridge Partners,https://www.bridgepartners.biz/,"Ciudad de Mexico, Mexico","argentina,colombia,mexico,peru,brazil,uruguay,panama,bolivia,chile","2. Prototype,3. Early Revenue,4. Scaling","We invest in LATAM-based companies raising a seed/bridge round in the prototype/early traction/traction phases, with ARR varying from 0 to 2M ARR.  Sector Agnostic. ",VC,$300000,$500000
Christian O. Edler,https://www.christianedler.com,"Berlin, Germany","usa,germany,malta,sweden,uk,colombia,switzerland","3. Early Revenue,4. Scaling,5. Growth,6. Pre-IPO","I invest in opportunity-driven, sector- and business-model agnostic.",Solo angel,$25000,$2000000
FEMSA Ventures,https://www.femsaventures.com/,"Gral. Pedro Maria Anaya 601, Monterrey, NL 64410, Mexico","mexico,brazil,usa,colombia,argentina,chile,peru","3. Early Revenue,4. Scaling","We invest in companies that can clearly benefit from leveraging collaboration opportunities with our business platforms and other portfolio companies.

FEMSA Ventures is a Venture Capital fund backed by FEMSA and dedicated to building collaboration bridges between FEMSA’s business platforms and the entrepreneurial ecosystem. ",Corporate VC,$500000,$5000000
MARC Group,http://www.marc-group.com/,"Limestone House, Dubai, UAE ","afghanistan,albania,algeria,andorra,antigua and barbuda,angola,argentina,armenia,australia,austria,azerbaijan,bahamas,bahrain,bangladesh,barbados,belarus,belgium,belize,benin,bhutan,bolivia,bosnia-h,botswana,brazil,brunei,bulgaria,burkina faso,burundi,cabo verde,cambodia,cameroon,canada,central african republic,chad,chile,china,colombia,comoros,congo (congo-brazzaville),costa rica,côte d'ivoire,croatia,cuba,cyprus,czech republic,drc congo,denmark,djibouti,dominica,ecuador,dominican republic,egypt,el salvador,equatorial guinea,eritrea,estonia,""eswatini (fmr. """"swaziland"""")"",ethiopia,fiji,finland,france,gabon,gambia,georgia,germany,ghana,greece,grenada,guatemala,guinea,guinea-bissau,guyana,haiti,holy see,honduras,hong kong,hungary,iceland,india,indonesia,iran,iraq,ireland,israel,italy,jamaica,japan,jordan,kazakhstan,kenya,kiribati,kuwait,kyrgyzstan,laos,latvia,lebanon,lesotho,liberia,liechtenstein,lithuania,luxembourg,lybia,madagascar,malawi,malaysia,maldives,mali,malta,marshall islands,mauritania,mauritius,mexico,micronesia,moldova,monaco,mongolia,montenegro,morocco,mozambique,myanmar,nauru,namibia,nepal,netherlands,new zealand,nicaragua,niger,nigeria,north korea,north macedonia,norway,pakistan,oman,palestine,palau,panama,papua new guinea,paraguay,peru,philippines,poland,portugal,qatar,romania,russia,rwanda,saint vincent and the grenadines,samoa,san marino,sant kitts and nevis,sant lucia,sao tome and principe,saudi arabia,senegal,serbia,seychelles,sierra leone,singapore,slovakia,slovenia,solomon islands,somalia,south africa,south korea,south sudan,spain,sri lanka,sudan,suriname,sweden,switzerland,syria,tajikistan,taiwan,tanzania,thailand,timor-leste,togo,tonga,trinidad and tobago,tunisia,turkey,turkmenistan,tuvalu,uae,uganda,uk,ukraine,uruguay,usa,uzbekistan,vanuatu,venezuela,vietnam,yemen,zambia,zimbabwe","2. Prototype,3. Early Revenue,4. Scaling","We invest in innovative early stage companies across sectors and geographies.

We’re a family office with 2 principals and a diverse portfolio of venture investments (edtech, healthtech, proptech, AI/ML, RPA, media & entertainment, marketplaces, fintech).",Family office,$25000,$1000000
Foundation Ventures,https://www.foundationventures.com,"23a Ismail Mohamed Street, El Zamalek, Cairo EG","egypt,jordan,uae","1. Idea or Patent,2. Prototype,3. Early Revenue","We invest in tech enabled sector agnostic startups. Foundation Ventures is an early-stage venture capital fund focused on Egypt and the MENA region backing exceptional founders building industry defining companies.

We unlock massive growth for our portfolio companies by giving them access to the largest distribution channels in the country.",VC,$100000,$500000
Scala,https://gruposcala.co/,"8a Calle 100, World Trade Center, Torre C, Oficina 407, Bogotá , Capital District 111121, CO","colombia,ecuador,chile,argentina,mexico","3. Early Revenue,2. Prototype","We invest in early stage startups with a scalable tech component, a huge market size and incredible founders. We are agnostic to the sector and aren’t scared to be the first check if we see potential. ",VC,$5000,$25000
Fil Rouge Capital,https://filrougecapital.com/,"Jurišićeva street 24, 10000 Zagreb, Croatia",croatia,"1. Idea or Patent,3. Early Revenue,4. Scaling,5. Growth","We invest in entrepreneurs, start-up, and scale-up companies based in Croatia. We are sector agnostic and we run an Acceleration program 2 times a year. Our mission is to build an entrepreneurial ecosystem and make the Croatian startup scene the next leader in the CEE region and beyond.",VC,$5000,$1000000
Miles Ahead,https://milesahead.ai/,"Coupure 53, Ghent, Belgium",belgium,"1. Idea or Patent,2. Prototype,3. Early Revenue","We invest in tools and applications that leverage technology in a responsible and transparent way in the field of Big Data, AI, HRTech, Cybersecurity, Web3, … Founders with a purpose only please.

",PE fund,$340000,$670000
Rebel Capital,https://www.rebel.vc/,"New York, NY","usa,argentina,mexico,colombia,brazil,canada,chile,france,uk,south korea,vietnam,japan,uae,israel,new zealand,australia","1. Idea or Patent,2. Prototype,3. Early Revenue",We invest in consumer tech + web3 companies globally at pre-seed and seed,VC,$250000,$750000
Exponential Impact,https://exponentialimpact.xyz/,USA,"australia,austria,belgium,ireland,finland,france,canada,chile,singapore,vietnam,usa,uk,netherlands,malaysia,greece,latvia,germany,italy,hong kong,luxembourg,liberia,kenya,hungary,mongolia,mexico,china,ghana,india,israel,indonesia,iceland,brazil,brunei,saudi arabia,ukraine,turkey,switzerland,south africa,south korea,spain,slovenia,sweden,sri lanka,denmark,new zealand,poland,portugal,japan","1. Idea or Patent,2. Prototype,3. Early Revenue,4. Scaling",We invest in companies that have the potential to save the world (literally). Focused on early stage frontier technology companies that can provide radically effective solutions for climate change.,Angel network,$50000,$250000
NEXT Canada,https://www.nextcanada.com/,"175 Bloor Street East, Suite 1800, South Building, Toronto, ON M4W 3R8, Canada",canada,"1. Idea or Patent,2. Prototype,3. Early Revenue","We invest in Canada’s next generation of entrepreneurs and supercharge their ambition by showing them what’s possible. We accelerate their trajectory with access to education, mentorship and funding.","Incubator, Accelerator",$1000,$100000
