Investor name,Website,Global HQ,Countries of investment,Stage of investment,Investment thesis,Investor type,First cheque minimum,First cheque maximum
Ponooc,https://ponooc.vc/,"Stadionplein 28, Amsterdam","austria,belgium,netherlands,germany,uk,spain,portugal,norway,sweden,denmark,estonia,france,switzerland,finland,iceland,greece,ireland,italy,luxembourg","3. Early Revenue,2. Prototype,4. Scaling","We invest in Sustainable Mobility startups (Mobility, transport, logistics, and mobility-related energy) in the European region (EU + UK). We invest in Series A rounds where startups have around €0,5 - €1M ARR.",VC,$500000,$5000000
Vulpes Investment Management,https://vulpesinvest.com/,"21 Merchant Road Floor 02, Unit 01 Singapore 058267",uk,"3. Early Revenue,2. Prototype,4. Scaling","We invest in Biotech, Diagnostics ",Family office,$50000,$50000000
Pjotr van Schothorst,https://www.pvs-investments.com/,"The Hague, The Netherlands","belgium,denmark,france,germany,netherlands,north macedonia,norway,sweden,uk","2. Prototype,3. Early Revenue","I invest in Deep tech, climate tech, early stage (seed/pre-seed).
Tickets size EUR 100k-700k.",Solo angel,$100000,$700000
Giancarlo Vergine,https://www.overventures.com/,"Milan, Italy","france,italy,spain","2. Prototype,3. Early Revenue,4. Scaling","I invest in pre-seed and seed startups with an impacting innovation and a technology soul.

SaaS, Foodtech, Healthtech, Impact and DeepTech",Solo angel,$5000,$100000
Hasoub Angels (formerly the Arab angels club),https://www.hasoub.org/aac,"Haatsma'ut 45 Haifa (wework), Haifa, Haifa 31000, IL","israel,usa",3. Early Revenue,We invest in underrepresented entrepreneurs,Angel network,$100000,$250000
National Telecom,https://www.ntplc.co.th/,"99 Chaengwattana Rd., Laksi, Bangkok 10210, Thailand",thailand,"4. Scaling,5. Growth,6. Pre-IPO","We invest in startups that improve how the public is served through data analytics, AI, robotic, city management, life science, healthcare, food, gaming, etc.",Other,$150000,$15000000
Block Dojo,https://blockdojo.io,"Plexal Park London, The Press Centre, Here East, 14 East Bay Lane,, London, London E20 3BS, GB",uk,1. Idea or Patent,We incubate any founder looking to build in Web3,"Incubator, Accelerator",$12000,$12000
Nova Growth Capital,https://novagrowthcapital.co.uk/,"57 Jordan Street, Liverpool, England L1 0BW, GB",uk,"1. Idea or Patent,2. Prototype,3. Early Revenue",We invest in businesses that come out of venture builders. ,VC,$100000,$300000
RocketX Fund One,https://investment.rocketx.group/,"Prinsengracht 739, Amsterdam","netherlands,belgium,luxembourg,germany,austria,switzerland,sweden,denmark,norway,finland","3. Early Revenue,4. Scaling,5. Growth","We invest in companies active in the People & Revenue domain, preferably selling to start-ups and scale-ups",VC,$100000,$5000000
Ilavska Vuillermoz Capital,https://www.ivc.fund/,"63-65, rue de Merl  L-2146 Luxembourg","germany,uk,france,luxembourg,finland","6. Pre-IPO,5. Growth,4. Scaling",We invest in later-stage European FinTechs.,VC,$1000000,$10000000
Honey Island Capital,https://honeyisland.capital/,"Rua Marechal Deodoro 630, Curitiba, Paraná 80020-320, BR","argentina,brazil,mexico,colombia,chile,uruguay,peru,venezuela,paraguay,ecuador","1. Idea or Patent,2. Prototype,3. Early Revenue","We invest in fintech and companies with a Saas B2B model.
Within fintech, the main verticals are credit, payments, crypto and investment.",VC,$200000,$1000000
f7 Ventures,https://www.f7ventures.com/,"83 ROUND HILL RD, TIBURON, CA, 94920","usa,canada","2. Prototype,3. Early Revenue,1. Idea or Patent","We invest in Future of Work, Communities, Health - Wellbeing ",VC,$500000,$750000
AFI Ventures,https://allianceforimpact.com/fr/afi-ventures/,"47, Avenue de l'opéra, Paris, Île-de-France 75002, FR","france,uk,spain,germany,italy,netherlands","3. Early Revenue,2. Prototype,4. Scaling",We invest in impact-driven startups reimagining every sector of the global economy in a fairer and more sustainable way. ,VC,$150000,$500000
NP-Hard Ventures,https://nphard.vc/,"Amsterdam, Netherlands","netherlands,uk,germany,usa,france,spain,denmark,sweden,finland,norway,romania,estonia,lithuania,belgium","2. Prototype,1. Idea or Patent,3. Early Revenue","We invest in product-obsessed founders, creating the building blocks of tomorrow. Our focus is early teams in Europe and the US who build the infrastructure, tools, and decentralized platforms that simplify the way we work, by making technology more accessible and unlock creativity.",VC,$100000,$400000
Smartfin,https://www.smartfinvc.com,"Brussels, Belgium","belgium,denmark,finland,france,germany,italy,luxembourg,netherlands,spain,sweden,switzerland,turkey","3. Early Revenue,4. Scaling,5. Growth",We invest in promising B2B technology companies across Europe that have achieved initial signs of product-market fit.,VC,$1000000,$20000000
Newgen Venture Partners,https://newgenvc.com/indexen/,"No. 19, Lane 3081, Hongmei Rd, Minhang District, Shanghai, China ","usa,china,hong kong,singapore,uk","1. Idea or Patent,2. Prototype,3. Early Revenue","We invest in industry agnostic pre-seed and seed stage startups, and we particularly value the startups founded by Gen-Z in the colleges who ""are not eager to become entrepreneurs"".",VC,$50000,$300000
Function Ventures,https://www.functionventures.com/,"New York, NY","india,usa,central african republic,south africa,angola,brazil,colombia,mexico,uae,drc congo,nigeria,qatar","4. Scaling,3. Early Revenue,5. Growth,2. Prototype,6. Pre-IPO","We accelerate companies primarily in Fintech and Commerce tech domains. These include payments, lending, crypto and blockchain/web3, regtech, cybersecurity, banking and neo-banking, loyalty, data and analytics, marketplaces, merchant ops, among others. We support portfolio companies by giving them access to an advisory network of C-level executives and successful entrepreneurs, high quality tech development (and other services), and an investor community.",Startup studio,$10000,$300000
Schumpeter Ventures,https://schumpeter.vc/,"Bockenheimer Landstraße 22, 60323 Frankfurt am Main","germany,austria,switzerland,israel","3. Early Revenue,4. Scaling,5. Growth,2. Prototype","We invest in founders building the next generation of financial services (focus on FinTech, InsurTech, CyberSec, Climate FinTech)",VC,$200000,$7000000
Philipp Angermann,https://pa.ventures/,"Munich, Germany","austria,germany,switzerland","1. Idea or Patent,2. Prototype,3. Early Revenue","I invest in Fintech, Impact and B2B SaaS.",Solo angel,$1000,$50000
Campus Fund,https://www.yourcampusfund.com/,"Bangalore, Karnataka, India",india,"2. Prototype,3. Early Revenue","We invest in Fintech, IoT, Web3, SaaS, AI, B2B, ",VC,$50000,$100000
Shri Capital,https://www.shri.capital/,"86-90 Paul Street, London EC2A 4NE","usa,uk,australia","3. Early Revenue,4. Scaling,5. Growth",We invest in the new generation of innovators who are emerging and thriving constantly to raise capital and are mostly overlooked and underestimated.,VC,$100000,$5000000
Spark Capital,https://www.sparkcapital.com/,"332 Pine Street, Floor 7 San Francisco, CA 94104","usa,germany,canada,uk,israel,france,finland,norway,denmark,sweden,spain,portugal","2. Prototype,3. Early Revenue,4. Scaling,5. Growth","We invest in the AI, consumer, commerce, devtools, fintech, software, frontier tech, and media sectors.",VC,$1000000,$50000000
Seraphim Space,https://seraphim.vc/,"1 Fleet Place, London, EC4M 7WS","uk,usa,india","3. Early Revenue,5. Growth,6. Pre-IPO,4. Scaling","We invest in Space, DeepTech, IoT, AgTech, AI, Analytics, ClimateTech/CleanTech, DeepTech, Hardware, Insurance, IoT, Smart, Cities/UrbanTech, from Series A to growth stage companies.",VC,$250000,$25000000
Lightning Ventures,https://ltng.ventures,"1200 Euclid Avenue #201 Miami Beach, FL 33139","usa,brazil,australia,colombia,france,switzerland,uae,mexico,canada,uk,israel","3. Early Revenue,4. Scaling,5. Growth,2. Prototype",We invest in Bitcoin companies. ,VC,$100000,$500000
Nunatak Capital,https://www.nunatakcapital.com/?lang=en,"pl. Trzech Krzyży 10/14, Warszawa, mazowieckie 00-449, PL",poland,"3. Early Revenue,4. Scaling",We invest in data science and artificial intelligence.,VC,$200000,$1000000
Q Angels,https://qangels.org,"Istanbul, Turkey","germany,uk,france,usa","2. Prototype,3. Early Revenue","We invest in Saas, fintech, healthtech, web3",Angel network,$50000,$500000
Swisscom Ventures,https://ventures.swisscom.com/,"Zürich, Zurich, Switzerland","usa,belgium,bulgaria,croatia,czech republic,denmark,estonia,finland,france,germany,greece,hungary,ireland,italy,latvia,lithuania,luxembourg,malta,netherlands,poland,portugal,romania,slovakia,slovenia,spain,sweden,switzerland,uk,israel","3. Early Revenue,4. Scaling,5. Growth,6. Pre-IPO","We invest in Series A / B / C rounds with tickets of $ 5 - 10million and as co-investors when it comes to investments outside Switzerland. Back at home, we lead financing rounds and also do Seed investments from time to time with a minimum of $1m in a round.",Corporate VC,$1000000,$10000000
Love Ventures,https://loveventures.co.uk/,"4 Winsley Street, London W1W 8HF, United Kingdom",uk,3. Early Revenue,"We invest at Seed into revenue-generating startups across FinTech, PropTech and ConsumerTech in the UK.",VC,$200000,$800000
Move Capital,https://move-capital.com/,"112 Avenue Kleber, 75016 Paris",france,5. Growth,"We invest in IoT, AI, Cyber Security, Data Analytics, Machine Learning, Industry 4.0, etc.
The company should generate min €5m ARR",Other,$10000000,$30000000
Arkéa Capital,https://www.arkea-capital.com/,"3 rue des colonies, 29200 Brest, France",france,"4. Scaling,5. Growth","We invest in climate and energy transition (carbon, biodiversity, pollution reduction, etc.), the circular economy (biosourced materials, recycling, eco-responsibility, etc.), human capital (HR, training, education, etc.) and health (silvertech, healthtech, etc.).",VC,$2000000,$5000000
Cerulean Ventures,https://cerulean.vc/,"901 Olive St, Santa Barbara CA, 93101","kenya,mexico,usa,france,germany,netherlands,portugal,spain,sweden,uk,morocco","1. Idea or Patent,2. Prototype","We invest in open source software, blockchain, crypto, and climate tech from pre-seed to seed, pre-revenue.",VC,$100000,$300000
Lewis & Clark Ventures,https://www.lewisandclarkventures.com/,"120 South Central Avenue Suite 1000 St. Louis, MO 63105","usa,canada","3. Early Revenue,4. Scaling",We invest in B2B SaaS with $1M+ ARR,VC,$2000000,$3000000
Creative UK,https://www.wearecreative.uk/,"Tomorrow Building, 130 Broadway, MediaCityUK M50 2UW",uk,"3. Early Revenue,4. Scaling","We invest in early-stage post-revenue businesses operating in the creative industries, from content, to distribution, technology and any related service including creator economy, saas, media, martech, createch, AI, content, agency, advertising, design, data tech and more.",Corporate VC,$300000,$600000
No Brand,https://www.nbrnd.com/,"Sydney, Australia","australia,new zealand","3. Early Revenue,4. Scaling","We invest in Australian or New Zealand startups in Seed or Series A rounds. Our areas of interest include: AI, ML, software, tech-enabled services and consumer",Family office,$25000,$1000000
ArK Kapital,https://www.arkkapital.com/,"Eriksbergsgatan 31, Stockholm, SE","uk,germany,sweden,denmark,finland,usa","3. Early Revenue,4. Scaling,5. Growth","We finance companies with predictable revenue streams. 

The Ark Growth Loan is designed to be the best complement to venture capital. The terms are custom in partnership to fit the nature of your growth trajectory - ranging between €1-€10m with maturities up to 7 years - so you won’t get weighed down in crucial states of your journey. 

We fund any models with predictable revenue streams, e.g. software, fintech, ecommerce ",Other,$1000000,$20000000
Strategic Group,https://www.strategicgroup.ca/venture-capital,"630 8 Ave SW, Calgary, AB, T3G 4C7, Canada","usa,canada,uk,israel,colombia,india","1. Idea or Patent,2. Prototype,3. Early Revenue,4. Scaling",We invest in Founders and companies solving real problems in our world. We are looking for true disruptors and not incremental solutions.,Family office,$25000,$100000
MediaTech Hub Accelerator,https://www.mth-potsdam.de/en/accelerator/,"Marlene-Dietrich-Allee 12a  14482 Potsdam, Germany",germany,"1. Idea or Patent,2. Prototype,3. Early Revenue",We invest in Media Tech,"Incubator, Accelerator",$0,$0
Flutter Finance,https://flutterfinance.com/,"539 Justice Road NW, Bemidji, MN 56601, United States","usa,singapore,japan,turkey","1. Idea or Patent,2. Prototype","We invest in and support early-stage companies in the web3 space. Our team specializes in finding and nurturing early-stage projects that have the potential to disrupt traditional finance and commerce. 

",Startup studio,$20000,$150000
No Label Ventures,https://nolabel.ventures,"33 Broadwick Street, London, England W1F 0DG, GB","uk,france,germany,spain,portugal,sweden,belgium,netherlands,italy,norway,denmark,finland,ireland,austria,switzerland,luxembourg","2. Prototype,1. Idea or Patent,3. Early Revenue",We invest in immigrant founders,VC,$150000,$250000
R17 Ventures,https://www.r17ventures.com,"Rennweg 57, Zürich, 8001, Switzerland","south africa,usa,austria,germany,switzerland,uk","2. Prototype,3. Early Revenue,4. Scaling,5. Growth","We invest in angel and pre-seed stage e-commerce and digital businesses, leveraging our performance marketing and Swiss market expertise to accelerate growth through online visibility.",VC,$25000,$1000000
Early Capital Group,https://www.earlycapitalgroup.com,"36 Carpenter St, Central Business District, Singapore 05, SG","china,france,hong kong,germany,saudi arabia,singapore,uae,usa,uk","1. Idea or Patent,2. Prototype,3. Early Revenue,4. Scaling,5. Growth,6. Pre-IPO","We invest in young, innovative startups as well as small to medium-sized companies driven by ambitious entrepreneurs. ",Family office,$50000,$5000000
Big Sky Capital,https://bigskycapital.co/,Singapore,"singapore,indonesia,malaysia,kazakhstan,usa","2. Prototype,3. Early Revenue,4. Scaling","We invest in B2B SaaS, Fintech, Medtech, Agritech, Industrial tech, web3, AI startups",VC,$50000,$500000
Atlantis Ventures,https://atlantis-ventures.com,"Baaderstr. 88, 80469 Munich, Germany","germany,austria,switzerland,sweden,uk,belgium,denmark,netherlands,usa,canada,finland,estonia,latvia,lithuania,luxembourg,spain,czech republic,france,hungary,iceland,new zealand","1. Idea or Patent,2. Prototype,3. Early Revenue,4. Scaling","We invest in B2B, B2C, SaaS, fintech, climate tech, proptech, software, marketplace, real estate, platform, health tech, e-commerce, ad tech, logistics, deep tech, Web3, big data, AI, ML, AR, generative AI.",VC,$25000,$300000
Kalyna Capital,https://kalynacapital.com/,"Los Angeles, CA, United States (home office)","ukraine,usa,poland,uk","3. Early Revenue,4. Scaling,2. Prototype","We invest in innovative, early-stage Ukrainian-related technology startups in priority verticals: Dual-use (MilTech), Cyber, AI/ML, FinTech, DeepTech. We also selectively invest in SpaceTech, Blockchain, AgTech, BioTech, and web3 startups.",VC,$250000,$2500000
Goose Valley Ventures,http://goosevalley.vc/,"Stockholm, Sweden","sweden,norway,denmark,finland,iceland","1. Idea or Patent,2. Prototype,3. Early Revenue",We invest in early-stage FinTech and Impact startups,VC,$100000,$1000000
Infinitum Partners,https://infinitumpartners.business,"Two IFC 12F. No. 1221, 10 Gukjeguemyung-ro, Youngdeungpo-gu, Seoul, Korea",south korea,"1. Idea or Patent,2. Prototype,3. Early Revenue,4. Scaling","We invest in sports, e-sports, entertainment, videogame and IT services.",VC,$500000,$5000000
Simpact Ventures,https://simpact.vc,"26/2 Wejnerta Str., Warsaw, Poland","austria,bulgaria,croatia,czech republic,estonia,hungary,latvia,lithuania,poland,romania,serbia,slovakia,slovenia,ukraine","4. Scaling,3. Early Revenue,2. Prototype,1. Idea or Patent",We invest in the best impact driven startups in Central and Eastern Europe and wider. We empower founders to build tech companies that combine profit with purpose. We believe that the impact which startup creates for the society represents the degree to which it solves actual problems and at the same time is the best indicator of its future financial performance. We are sector agnostic.,VC,$150000,$2000000
StartCapital Partners,https://www.startcapitalpartners.com/,"Postbus 34, 1260 AA Blaricum, Netherlands",netherlands,"3. Early Revenue,2. Prototype","We invest in owned IP. Technical person must be a shareholder. View on MRR, SaaS, NL ventures only. At least MVP needed.",VC,$100000,$500000
Pegasus India Evolving Opportunities Funds,https://www.pegasusfininvest.com/,"Olympia building, Technology St, Hiranandani Gardens, Mumbai, India",india,"4. Scaling,5. Growth,6. Pre-IPO,3. Early Revenue","We invest in cleantech, Edutech, fintech, cleantech",VC,$100000,$500000
ID Capital,https://www.idcapital.com.sg/,"Shaw Centre #24-05, 1 Scotts Road, Singapore","australia,china,france,germany,south korea,singapore,israel,netherlands","2. Prototype,3. Early Revenue","We invest in transformative agritech and foodtech startups contributing to make our food system more sustainable (alternative proteins, regenerative agriculture, circularity solutions, food safety, climate tech)",Family office,$100000,$1000000
Beeso Studio,https://www.beeso.io/,"6818 Grover St Suite #107, Omaha, NE 68106",usa,"1. Idea or Patent,2. Prototype,3. Early Revenue","We partner with early-stage software startups to apply expertise in software development, operations, marketing, sales and fundraising to help you launch and scale. The best technical partner to get software startups from 0-1.",Startup studio,$0,$0
Summit Works,https://www.summitworks.co/,29 C Douglas Avenue Stamford CT 06906,india,"1. Idea or Patent,2. Prototype,3. Early Revenue,4. Scaling,5. Growth","We invest in early-stage Agritech, Fintech, Deeptech, B2B tech, SAAS, Environment Tech, EV, and Climate tech startups based in India and USA. The average ticket size is $500K",VC,$500000,$500000
Ethias Ventures,https://www.linkedin.com/company/ethiasventures/,"rue des croisiers, 24, 4000 Liège, Belgium","belgium,denmark,finland,france,germany,italy,luxembourg,netherlands,norway,spain,sweden,uk","3. Early Revenue,4. Scaling","We invest in European start-ups in InsurTech, Mobility, Health and Property with a link to insurance value chain (underwriting, claims, product, ...) and with visible traction (product available, first customers / traction) ",Corporate VC,$1000000,$3000000
De Eik,https://www.deeik.com/,"Eikelenbergstraat 20, Dilbeek, 1700, Belgium",belgium,"4. Scaling,5. Growth,6. Pre-IPO","We invest in directly and indirectly through VC/PE funds in growth companies active in the sectors of technology, food & agritech and healthcare.",Family office,$1000000,$20000000
SID Venture Partners,https://sid.fund,"16192 COASTAL HWY, LEWES DE 19958-3608, USA","usa,estonia,poland,portugal,romania,ukraine","2. Prototype,3. Early Revenue,4. Scaling","We invest in global software companies built by Ukrainian and CEE founders. We are mostly an industry-agnostic firm with a preference for DeepTech, B2B, Fintech, AI, and Blockchain projects. ",VC,$100000,$400000
VGC Partners,https://vgc.partners/,"Portman House, 2 Portman Street, London, W1H 6DU","usa,germany,netherlands,uk","3. Early Revenue,4. Scaling,5. Growth","We invest in consumer, digital media and technology companies from Seed to Series B. EIS and non-EIS investment available. ",VC,$200000,$12000000
Tenzing.vc,https://www.tenzing.vc/,"Wichita, KS",usa,"2. Prototype,3. Early Revenue,4. Scaling","We invest in early-stage US-based B2B / Enterprise-focused SaaS and FinTech startups with early revenue through $5M ARR, often in overlooked geographies across the US.",VC,$50000,$200000
ODBA,https://www.odba.vc/,London. UK,"côte d'ivoire,ethiopia,ghana,kenya,nigeria,rwanda,senegal,south africa,zambia,egypt","2. Prototype,3. Early Revenue,4. Scaling","We invest in early stage (Pre Seed and Seed) companies building the future in Fintech, Edtech, Healthtech, Logistics, AI/ML and Climatetech.",VC,$50000,$500000
The Helm,https://thehelm.co/,"31 W 8th Street, 2nd Floor, New York, New York 10011, US",usa,"1. Idea or Patent,2. Prototype,3. Early Revenue,4. Scaling",We invest in game-changing companies founded by women. ,VC,$500000,$750000
Auriga Cyber Ventures,https://www.cyberimpactventures.com/,"250 Bis Rue du Faubourg Saint-Honoré, 75008 Paris","france,switzerland,uk,belgium,netherlands,germany,luxembourg",3. Early Revenue,We invest in cybersecurity.,VC,$500000,$1000000
Paolo Siligoni,https://www.linkedin.com/in/paolo-siligoni-b493444/,Italy,"italy,monaco,switzerland,uk","3. Early Revenue,4. Scaling",I invest in startups connected to DAO in Blockchain with technology connected to smart contract and smart invest.,Solo angel,$100000,$5000000
Presto Ventures,https://www.prestoventures.com,"Senovážné Náměstí 28, Prague, Czech Republic","albania,azerbaijan,armenia,bosnia-h,bulgaria,croatia,czech republic,estonia,georgia,israel,holy see,kazakhstan,kyrgyzstan,latvia,hungary,lithuania,moldova,montenegro,north macedonia,poland,romania,serbia,slovakia,slovenia,tajikistan,turkmenistan,turkey,ukraine,uzbekistan",3. Early Revenue,We invest in B2B (SaaS) and marketplaces with a strong connection to CEE+ or CA,VC,$300000,$2000000
Tremis Capital,https://www.tremis.in/,"N138, Panchsheek Park, New Delhi","usa,india,singapore,uae,brazil,nigeria","3. Early Revenue,2. Prototype,4. Scaling","We invest in fintech, web3, SaaS, blockchain, gaming, health tech, enterprise tech, consumer internet, marketplaces with 50k to 5 Mn ARR. We prefer to never lead a round, and co-invest with the lead investor on similar round terms.",Angel network,$50000,$250000
Bri Cho,https://www.linkedin.com/in/briannaycho/,UK/Europe,"canada,usa,china,hong kong,japan,singapore,south korea,vietnam,austria,belgium,croatia,cyprus,czech republic,denmark,estonia,finland,france,germany,greece,hungary,iceland,ireland,italy,latvia,liechtenstein,lithuania,luxembourg,malta,monaco,netherlands,norway,poland,portugal,romania,spain,sweden,switzerland,uk,israel,australia,new zealand","2. Prototype,3. Early Revenue,4. Scaling,5. Growth,6. Pre-IPO","I invest in all sectors and most geos, but am looking for strong founder market fit.",Solo angel,$1000,$200000
FLORA Ventures,https://www.floravc.com/,"Hayarkon St. 73, Tel-Aviv, Israel","israel,germany,belgium,switzerland,austria,croatia,belize,czech republic,denmark,estonia,finland,france,greece,hungary,iceland,ireland,italy,liechtenstein,luxembourg,lithuania,monaco,malta,cyprus,uk,uae,sweden,spain,slovenia,slovakia,serbia,portugal,norway,turkey,morocco,netherlands,poland,romania,latvia","1. Idea or Patent,2. Prototype,3. Early Revenue,4. Scaling","We invest in the best purpose-led entrepreneurs redefining the $8T Agri-FoodTech & Sustainability industries, to make food that is good for people, and kind to the planet. The fund’s investment thesis is focused on the intersection of the Agriculture and Food industries with Planetary, Climate & Human Health, all underpinned by deep-tech.",VC,$1000000,$5000000
COINsiglieri,https://coinsiglieri.com/,"Romania, Bucharest ","malawi,mauritius,south africa,canada,usa,maldives,austria,belgium,bulgaria,cyprus,estonia,france,germany,greece,italy,liechtenstein,lithuania,luxembourg,malta,moldova,romania,serbia,spain,switzerland,uk,ukraine,israel,turkey","1. Idea or Patent,2. Prototype,3. Early Revenue,4. Scaling","We accelerate startups from Crypto, FinTech, neo-banking, PSP, SaaS, NFTs, Fashion, Sports sectors","Incubator, Accelerator",$10000,$50000
Endurance Companies,https://www.endurancecos.com/,"1007 General Kennedy Ave, San Francisco, CA 94129, United States",usa,"1. Idea or Patent,2. Prototype,4. Scaling,3. Early Revenue,5. Growth,6. Pre-IPO",We invest across a range of categories with an emphasis on very early stage fintech and healthcare startups with strong founders.,Family office,$50000,$1000000
Francis Santora,https://tremendous.blog,"Hudson County, NJ","canada,usa,ireland,uk,australia,new zealand","3. Early Revenue,4. Scaling","I invest in companies like this:

- $200-500k revenue growing fast
- Huge market
- Great product
- Great founder

That said, I love meeting great founders early. Then, when the time is right, I place my bet. :)",Solo angel,$5000,$25000
Studio Investments,https://studio.investments/,"54 W 40th St, New York, NY 10018",usa,"3. Early Revenue,4. Scaling,5. Growth",We invest in people focused on building profit-driven companies and creating jobs.,VC,$250000,$50000000
Aloniq,https://www.aloniq.com/,"Tel Aviv, Israel","usa,singapore,uk,israel","1. Idea or Patent,2. Prototype,3. Early Revenue,4. Scaling",We invest in early-stage startups (from pre-seed to Series A) in deep tech and software domains.,VC,$100000,$500000
Ritesh Lalwani,https://www.ekosystem.company,UAE,"india,uae","3. Early Revenue,4. Scaling","I invest in businesses with a practical business plan, demonstrated PMF and solid founder / founding team. I am sector agnostic. Check out some of my investments on www.ekosystem.company",Solo angel,$1000,$50000
